{
  "$schema": "https://friday.local/schemas/meta/adapter-manifest.schema.json",
  "id": "mock-tasks",
  "name": "Mock Tasks",
  "adapterVersion": "1.0.0",
  "contractVersion": "2.0.0",
  "apiVersion": "v1",
  "category": "tasks",
  "capabilities": ["tasks.read", "tasks.create", "tasks.update", "tasks.cancel", "tasks.stream"],
  "configSchemaRef": "adapters/mock-tasks/config.schema.json",
  "secretFields": []
}
